ID;Überschrift;Kurztext;Text;Linien;Startdatum;Enddatum;Quelle;Anhänge;Links;Bild;Kategorien;Nachrichtentypen;Zeitstempel;Betroffene Haltestellen;Aktualisierungszeit
01ef324f-2934-4857-88ff-9a36af224dbd;Auf der Linie S4 zwischen Marbach(N) und Backnang ist bis auf Weiteres kein S-Bahnverkehr möglich.;Streckensperrung nach Unwetter: S4 wird zwischen Marbach (N) und Backnang durch Busse ersetzt..;"<p>Die Züge der&nbsp;<strong>S4&nbsp;</strong>fahren bis auf Weiteres im&nbsp;<strong>Abschnitt Stuttgart Schwabstraße - Marbach.</strong>&nbsp;Die DB setzt zwischen den Bahnhöfen&nbsp;<strong>Marbach und Backnang Busse als Ersatz</strong>&nbsp;für die S-Bahnen der Linie S4 ein. Die als&nbsp;<strong>Linie S4E gekennzeichneten Busse</strong>&nbsp;fahren im Halbstundentakt und halten in</p><ul><li>Marbach(N), Bahnhof</li><li>Erdmannhausen, Bahnhofstraße</li><li>Erdmannhausen, Rathaus</li><li>Kirchberg (M), Marbacher Str.</li><li>Kirchberg (M), Rathaus</li><li>Burgstall (M), Bahnhof</li><li>Erbstetten-Ortsmitte</li><li>Backnang, ZOB</li></ul><p>Die Busse fahren in Backnang früher ab als die S-Bahnen und kommen in der anderen Richtung dort später an.</p><p></p><p>Ein Hangrutsch nach Unwetter hat am 26. Juni die Gleisanlagen im Bahnhof Kirchberg (M) erheblich zerstört, weshalb zwischen Marbach (N) und Backnang bis auf Weiteres kein Zugverkehr mehr möglich ist. Aufgrund der örtlich instabilen Böden ist ein Gutachten von Geologen und Hydrologen erforderlich. Nach Auswertung des Gutachtens informiert die DB über die notwendigen Maßnahmen und Arbeiten bis zur Wiederaufnahme des Zugbetriebs.</p><p>Bitte informieren Sie sich vor Fahrtantritt und planen die längere Fahrzeit der Busse mit ein.</p>";S 24, S 4;2024-06-26T19:35:57.259;2024-12-14T23:59:00;RisDisruptions;Fahrplan 09.09-14.12.2024.pdf;"Informationen zu den Abfahrtshaltestellen des Ersatzverkehrs; weitere Informationen";https://assets-ri.extranet.deutschebahn.com/regio_sbahn_stuttgart/2024-11-12/52879ad8-b2f1-4a22-8d73-b7a439f57e23reisendenkarte_20240930-155251.png;;2;2024-11-19T11:17:06.082845;8000873, 8003853;2024-11-19T12:17:09.728507
4a27d475-1cd3-447e-b013-b9fcd84c96df;Bad Cannstatt <> Esslingen(N): Haltausfälle und Ersatzverkehr;Von 15. November, 21.00 Uhr bis 18. November, 5.00 Uhr sowie 22. November, 21.00 Uhr bis 25. November, 5.00 Uhr finden zwischen Obertürkheim und Bad Cannstatt Arbeiten an der Leit- und Sicherungstechnik statt.;"<ul><li><strong>S1 Richtung Herrenberg: </strong>Haltausfall in Obertürkheim, Untertürkheim und Neckarpark</li><li><strong>S1 Richtung Kirchheim(T):</strong> Haltausfall Neckarpark, Obertürkheim</li><li><strong>Zwischen Bad Cannstatt und Esslingen(N) fährt ein Ersatzverkehr mit Bussen (S1E) </strong>mit Halt in Mettingen, Obertürkheim, Untertürkheim und Neckarpark.</li></ul><p><strong>Information zum VfB-Heimspiel gegen VfL Bochum am 23.11.2024</strong></p><p>In Folge von Straßensperrungen während des VfB Stuttgart Heimspiels gegen VfL Bochum am 23.11.2024 kann der Ersatzverkehr S1E von 14.00 Uhr bis 18.45 Uhr&nbsp;die Stationen Neckarpark und Bad Cannstatt nicht anfahren.&nbsp;Bitte nutzen Sie zur An- und Abreise ins Stadion den Bahnhof Bad Cannstatt.&nbsp;</p><p>Bitte berücksichtigen Sie diese Abweichungen bei Ihrer Reiseplanung und informieren Sie sich vorab über Ihre Reiseverbindungen. Um keine kurzfristigen Änderungen zu verpassen, informieren Sie sich bitte auch unmittelbar vor Fahrtantritt in den digitalen Reiseauskunftsmedien unter&nbsp;bahn.de&nbsp;oder in der App DB Navigator.</p>";S 1;2024-11-15T21:00:00;2024-11-25T05:00:00;RisDisruptions;Fahrplan Ersatzverkehr S1E Esslingen - Bad Cannstatt_15.-17.11._22.-24.11.pdf;weitere Informationen;https://assets-ri.extranet.deutschebahn.com/regio_sbahn_stuttgart/2024-11-06/8cb5142a-7cca-44ff-b42b-126c770762f1reisendenkarte_20241025-102101.png;;2;2024-11-19T11:17:06.082845;8006743, 8005769;2024-11-19T12:17:09.728569
f89486cc-4640-487d-bf0a-5c6b13f745c7;Stuttgart-Schwabstraße <-> S-Vaihingen: Haltausfälle ;In den Nächten 17./18. und 28./29. November, 23.40 Uhr bis 2.00 Uhr, finden Schleifarbeiten zwischen S-Schwabstraße und S-Vaihingen statt.;"<p><strong>S3 mit Abfahrt in S-Schwabstraße um 0.20 Uhr und S3 mit Abfahrt S-Vaihingen um 1.00 Uhr entfällt in beiden Richtungen zwischen S-Schwabstraße und S-Vaihingen.</strong></p><p>Bitte berücksichtigen Sie diese Abweichungen bei Ihrer Reiseplanung und informieren Sie sich vorab über Ihre Reiseverbindungen. Um keine kurzfristigen Änderungen zu verpassen, informieren Sie sich bitte auch unmittelbar vor Fahrtantritt in den digitalen Reiseauskunftsmedien unter&nbsp;bahn.de&nbsp;oder in der App DB Navigator.</p>";S 3;2024-11-17T23:40:00;2024-11-29T02:00:00;RisDisruptions;;weitere Informationen;https://assets-ri.extranet.deutschebahn.com/regio_sbahn_stuttgart/2024-10-29/b78bf4f4-1494-48df-8a3b-68d9a20a0547reisendenkarte_20241029-143719.png;;2;2024-11-19T11:17:06.082845;8005776, 8005779, 8006513, 8006698;2024-11-19T12:17:09.728618
e5095c05-382a-4955-a54a-726e5428fe21;Instandhaltungsfenster 2024: Fahrtänderungen im S-Bahnverkehr aufgrund von Baustelle;Wegen Instandhaltungsarbeiten im S-Bahn-Tunnel kommt es in 23 Nächten von Montag auf Dienstag zwischen 22.30 Uhr und 4.30 Uhr zu Fahrplanänderungen im S-Bahn-Verkehr.;"<h1><strong>Geänderte Linienverläufe und Fahrzeiten</strong></h1><p>in unterschiedlichen Zeiträumen, <strong>jeweils in den Nächten Montag/Dienstag</strong></p><ul><li><strong>S1</strong> verkehrt <strong>in angepassten Fahrzeiten</strong> und über Stuttgart <strong>Hauptbahnhof (oben)</strong> - ohne Halt zwischen S-Hauptbahnhof und S-Vaihingen</li><li><strong>S2</strong> verkehrt <strong>in angepassten Fahrzeiten</strong> mit <strong>allen Halten </strong>zwischen Stuttgart Hauptbahnhof (tief) und Schwabstraße / S-Vaihingen</li><li><strong>S3</strong> verkehrt zwischen Backnang und Stuttgart <strong>Hauptbahnhof (oben)</strong></li><li><strong>S4 </strong>verkehrt zwischen Backnang / Marbach (N) und Stuttgart <strong>Hauptbahnhof (oben)</strong></li><li><strong>S5 </strong>verkehrt <strong>in angepassten Fahrzeiten </strong>mit <strong>allen Halten </strong>zwischen Stuttgart Hauptbahnhof (tief) und Schwabstraße</li><li><strong>S6</strong> verkehrt zwischen Weil der Stadt und Stuttgart <strong>Hauptbahnhof (oben)</strong></li></ul><h1></h1><h1><strong>Das Instandhaltungsfenster findet jeweils in den Nächten von Montag auf Dienstag statt:</strong></h1><h1></h1><ul><li>Im November 2024: 18./19. November, 21./22. November</li><li>Im Dezember 2024: 9./10. Dezember</li></ul><p>Eine Jahreskalenderübersicht finden ist im Downloadbereich bereitgestellt.</p><h1><strong>Warum eigentlich Instandhaltungsfenster?</strong></h1><p>Damit die Gleise und die Technik im S-Bahntunnel fit bleiben, benötigt DB Netz auch im Jahresfahrplan 2024 für die Instandhaltungsarbeiten ausreichend zusammenhängende Zeitfenster.&nbsp;Um tagsüber den Betrieb nicht zu stören, haben wir die Arbeiten nachts gebündelt. Wir nennen sie Instandhaltungsfenster.</p><p>Die DB Netz AG hat als Infrastrukturbetreiber mit uns der S-Bahn Stuttgart ein Konzept erarbeitet:</p><p>Zwischen Stuttgart Hbf (tief) und Stuttgart-Vaihingen wird während dieser Zeit lediglich ein reduziertes Fahrplanangebot&nbsp;im S-Bahntunnel gefahren. Zudem werden in diesem Zeitraum die Fahrzeiten einzelner Linien angepasst, sodass Anschlüsse ggf. nicht erreicht werden.&nbsp;Die Änderungen sind im Jahresfahrplan enthalten und über die elektronische Fahrplanauskunft bei der DB oder in den Apps abrufbar.&nbsp;</p>";S 2, S 3, S 5;2024-11-18T22:30:00;2024-12-09T04:30:00;RisDisruptions;"Instandhaltungsfenster-Stammstrecke-2024-webansicht-data.jpg; Kalender-Instandhaltungsfenster-Stammstrecke-2024-data (1).pdf";;https://assets-ri.extranet.deutschebahn.com/regio_sbahn_stuttgart/2024-11-12/941f5d20-961d-45e4-9ce7-acf231341df9reisendenkarte_20241028-084955.png;isInTimeInterval, isWeek;2;2024-11-19T11:17:06.082845;8006699, 8006513, 8006700, 8005779, 8006698, 8005776, 8098096;2024-11-19T12:17:09.728651
ea80a662-c1a1-4bde-989c-44587c3de9a1;Ausfall der S-Bahn-Linie S62 wegen kurzfristigem Personalausfall.;.;<p>Fahrgästen zwischen Weil der Stadt und S-Zuffenhausen wird empfohlen, die parallel im 15-Minuten-Takt fahrenden S-Bahnen der Linien S6 und S60 zu nutzen. Bitte prüfen Sie Ihre Reiseverbindung online vor Fahrtantritt.</p>;S 62;2024-11-19T05:30:00;2024-11-19T19:30:00;RisDisruptions;;;;isWeek;1;2024-11-19T11:17:06.082845;8006268, 8001476, 8005778, 8006271, 8003409, 8003652;2024-11-19T12:17:09.728716
6e7c6bb2-d2e5-47c5-a36d-1297eccefc64;Ausfall der Linie RB11 ;.;<p>Ausfall der Linie <strong>RB11 </strong>wegen kurzfristigem Personalausfall.</p><p>Alternativ können Sie in Untertürkheim die Linie S1 und in Kornwestheim die Linie <strong>S4 </strong>sowie <strong>S5 </strong>nutzen. Bitte berücksichtigen Sie bei Ihrer Reiseplanung, die dadurch verlängerte Reisezeit. Für die entstehenden Unannehmlichkeiten bitten wir Sie um Entschuldigung.</p>;RB 11;2024-11-19T05:30:00;2024-11-19T18:30:00;RisDisruptions;;;;isWeek;1;2024-11-19T11:17:06.082845;8005766, 8003411, 8005777, 8005771, 8005775;2024-11-19T12:17:09.728770
862dc991-cedc-49cf-910e-86f7c774433c;Ausfall der Linie RB64 (Teckbahn). Es besteht ein Ersatzverkehr mit Bussen.;.;<p>Die Fahrten der Teckbahn (Linie RB64) entfallen zwischen Kirchheim (T) und Oberlenningen. Grund hierfür sind kurzfristige Krankmeldungen beim Fahrpersonal der S-Bahn Stuttgart. Die Deutsche Bahn setzt einen SEV der Firma Fischer mit allen Unterwegshalten ein, dieser verkehrt analog zur Buslinie 177. Zusätzlich verkehrt zur RB 37954 von Oberlenningen (06:52 Uhr) nach Kirchheim (T) ein Bus mit Halt in Oberlenningen und Unterlenningen ohne weiteren Halt nach Kirchheim (T). </p>;RB 64;2024-11-19T05:30:00;2024-11-19T20:30:00;RisDisruptions;;;https://assets-ri.extranet.deutschebahn.com/regio_sbahn_stuttgart/2024-11-18/a86e439f-c3cc-4e7d-9467-54a88f07f5a4reisendenkarte_20241118-174342.png;isWeek;1;2024-11-19T11:17:06.082845;8001428, 8001205, 8003283, 8004740, 8004553, 8003280, 8005998;2024-11-19T12:17:09.728788
f4270fdb-5881-47e4-9716-b5cf7e178c5e;Stuttgart Hbf <> Bad Cannstatt: Zugausfälle und Ersatzverkehr;Im Zeitraum 20. November 4.00 Uhr bis 23. November 0.45 Uhr finden Weichenarbeiten zwischen Stuttgart Hbf und Bad Cannstatt statt.;"<p>Es kommt zu folgenden <strong>Änderungen im Liniennetz der S-Bahn Stuttgart</strong>:</p><ul><li>S1 verkehrt nur zwischen Kirchheim(T) und Bad Cannstatt.</li><li>S2 verkehrt nur zwischen Schorndorf und Waiblingen.</li><li>S3 verkehrt nur zwischen Backnang und Bad Cannstatt.</li><li>Baustellenlinie S15 zwischen Herrenberg und Bietigheim-Bissingen.</li><li>Baustellenlinie S24 zwischen Filderstadt und Marbach(N).</li><li>Baustellenlinie S36 zwischen Flughafen/Messe und Weil der Stadt.</li><li>S60 verkehrt nur zwischen Zuffenhausen und Böblingen via Renningen.</li><li><strong>Zwischen Stuttgart Hbf und Bad Cannstatt&nbsp;fährt&nbsp;ein Ersatzverkehr mit Bussen im 5/10-Minuten-Takt</strong>.<strong>&nbsp;</strong>Bitte beachten Sie die längeren Fahrzeiten der Busse und wählen Sie gegebenenfalls eine frühere Verbindung.</li></ul><p>Bitte berücksichtigen Sie diese Abweichungen bei Ihrer Reiseplanung und informieren Sie sich vorab über Ihre Reiseverbindungen. Um keine kurzfristigen Änderungen zu verpassen, informieren Sie sich bitte auch unmittelbar vor Fahrtantritt in den digitalen Reiseauskunftsmedien unter&nbsp;bahn.de&nbsp;oder in der App DB Navigator.</p>";S 1, S 15, S 2, S 24, S 3, S 36, S 4, S 5, S 6, S 60;2024-11-20T05:00:00;2024-11-23T00:45:00;RisDisruptions;"Bauarbeiten BC 20-22_11_2024.pdf; Fahrplan XEV Stuttgart Hbf – Bad Cannstatt_20.-22.11.pdf";"weitere Informationen: Weichenarbeiten zwischen Stuttgart Hbf und Bad Cannstatt von Mittwoch; weitere Informationen";https://assets-ri.extranet.deutschebahn.com/regio_sbahn_stuttgart/2024-11-15/db6d6db0-793f-41b0-9886-04d18099caa1reisendenkarte_20241007-104509.png;;2;2024-11-19T11:17:06.082845;8006700, 8006743, 8005769, 8005779, 8006642, 8001921, 8005772, 8006698, 8006346, 8005775, 8098096, 8001055, 8005773, 8000508, 8006513, 8002165, 8003022, 8006331, 8004528, 8006699, 8003280, 8005776, 8004490, 8000038, 8005778, 8000630, 8000235, 8001689, 8005201, 8005767, 8003411, 8002785, 8003622, 8004496, 8001785, 8002240, 8002448, 8006277, 8001650, 8000934, 8005157, 8005768, 8000873, 8003853, 8002065, 8001967, 8001984, 8005774, 8005454, 8004357, 8000016, 8000180, 8004233, 8004333, 8003913, 8003409, 8002892, 8000313, 8005236, 8003652, 8001476, 8004338, 8006271, 8005820, 8000096, 8005770, 8003808, 8005001, 8003807, 8003834, 8005574, 8000302, 8001920, 8003282, 8005726, 8006485, 8005424, 8001974, 8006479, 8003831, 8006268;2024-11-19T12:17:09.728811
895f8238-1108-4e2d-ba6d-0db4fbdab3fd;Plochingen <> Kirchheim(T) <> Oberlenningen: Haltausfälle und Ersatzverkehr;In der Nacht 23./24. November von 21.00 Uhr bis 5.00 Uhr finden Instandhaltungsarbeiten zwischen Wendlingen und Kirchheim(T) statt.;"<ul><li>S1 hält nicht zwischen Plochingen und Kirchheim(T)</li><li>RB64: die letzten zwei Fahrten zwischen Kirchheim(T) und Oberlenningen entfallen.  </li><li>Zwischen Plochingen und Kirchheim(T) sowie Kirchheim(T) und Oberlenningen fährt ein Ersatzverkehr mit Bussen.</li></ul><p>Bitte beachten Sie die früheren Abfahrtszeiten der Busse in Kirchheim(T) sowie die längeren Fahrtzeiten der Busse.</p><p>Bitte berücksichtigen Sie diese Abweichungen bei Ihrer Reiseplanung und informieren Sie sich vorab über Ihre Reiseverbindungen. Um keine kurzfristigen Änderungen zu verpassen, informieren Sie sich bitte auch unmittelbar vor Fahrtantritt in den digitalen Reiseauskunftsmedien unter&nbsp;bahn.de&nbsp;oder in der App DB Navigator.</p>";RB 64, S 1;2024-11-23T20:00:00;2024-11-24T05:00:00;RisDisruptions;"Busfahrplan RB 64_Oberlenningen - Kirchheim.pdf; Busfahrplan S1E Plochingen-Kirchheim.pdf";weitere Informationen;https://assets-ri.extranet.deutschebahn.com/regio_sbahn_stuttgart/2024-10-25/bab87358-9e53-486d-9c54-9b8ba72c64ddreisendenkarte_20241025-093039.png;isWeekend;2;2024-11-19T11:17:06.082845;8005998, 8001428, 8001205, 8003283, 8004740, 8004553, 8000302, 8003282, 8006346, 8003280, 8006331;2024-11-19T12:17:09.728860
c0a36e58-6d5f-4b7e-9fc5-50f7d74bab2f;Oberleitungsarbeiten im Bereich Pragtunnel: Halt- und Zugausfälle auf den Linien S4, S5 und S6;Oberleitungsarbeiten im Bereich Pragtunnel: Halt- und Zugausfälle auf den Linien S4, S5 und S6 zwischen Stuttgart Hbf und Zuffenhausen;<p><strong>In der Nacht 25./26. November</strong> – ca. 22:30 Uhr bis 1:00 Uhr</p><ul><li>Die Linie <strong>S4 in Richtung Marbach</strong> verkehrt ohne Halt in Nordbahnhof und Feuerbach.</li></ul><p><strong>In den Nächten 25./26. und 26./27. November</strong> - jeweils ca. 21:00 Uhr bis 5:00 Uhr</p><ul><li>Die Linien <strong>S4 und S5 </strong>verkehren in Richtung S-Schwabstraße ohne Halt in Feuerbach.</li><li>Die Linie <strong>S6 entfällt zwischen S-Schwabstraße und Zuffenhausen</strong>.</li></ul><p>Bitte berücksichtigen Sie diese Abweichungen bei Ihrer Reiseplanung. Um keine kurzfristigen Änderungen zu verpassen, informieren Sie sich bitte unmittelbar vor Fahrtantritt in den digitalen Reiseauskunftsmedien unter bahn.de oder in der App DB Navigator.</p>;S 4, S 6, S 60;2024-11-25T21:00:00;2024-11-27T05:00:00;RisDisruptions;;weitere Informationen;https://assets-ri.extranet.deutschebahn.com/regio_sbahn_stuttgart/2024-10-29/290b47a4-23b1-4824-b4bf-9f9d0aa4d963reisendenkarte_20241008-111555.png;isInTimeInterval, isWeek;2;2024-11-19T11:17:06.082845;8000096, 8006699, 8006700, 8005778, 8006698, 8098096;2024-11-19T12:17:09.728890
f0d8e6eb-ea0d-4cee-a205-ac692367d00f;S-Vaihingen <-> Bad Cannstatt: Haltausfälle und Ersatzverkehr;In der Nacht 27./28. November, 21.30 Uhr bis 2.00 Uhr, finden Schleifarbeiten zwischen S-Schwabstraße und S-Vaihingen statt.;"<ul><li>S1 verkehrt in den Abschnitten Kirchheim(T) und S-Schwabstraße sowie S-Vaihingen und Herrenberg.</li><li>S2 verkehrt in den Abschnitten Schorndorf und Stuttgart-Hauptbahnhof (oben) sowie S-Vaihingen und Herrenberg.</li><li>S3 verkehrt nur zwischen Backnang und Bad Cannstatt.</li></ul><p><strong>Zwischen S-Hauptbahnhof und S-Vaihingen verkehrt in beiden Richtungen ein Ersatzverkehr mit Bussen.</strong></p><p>Bitte berücksichtigen Sie diese Abweichungen bei Ihrer Reiseplanung und informieren Sie sich vorab über Ihre Reiseverbindungen. Um keine kurzfristigen Änderungen zu verpassen, informieren Sie sich bitte auch unmittelbar vor Fahrtantritt in den digitalen Reiseauskunftsmedien unter&nbsp;bahn.de&nbsp;oder in der App DB Navigator.</p>";S 1, S 2, S 3;2024-11-27T21:30:00;2024-11-28T02:00:00;RisDisruptions;Fahrplan S1E_Stuttgart Hbf-Vaihingen.pdf;weitere Informationen;https://assets-ri.extranet.deutschebahn.com/regio_sbahn_stuttgart/2024-10-29/d1f20bfb-2dc1-4edc-8930-41fa4531227areisendenkarte_20241029-161935.png;isInTimeInterval, isWeek;2;2024-11-19T11:17:06.082845;8006700, 8006699, 8006513, 8005779, 8005769, 8000096, 8098096, 8006698, 8005776;2024-11-19T12:17:09.728920
4b4300ef-64dc-4df1-9d32-cbf6cfa828a6;Zuffenhausen: Haltausfälle und Verweis auf Linie S6;In der Nacht 1./2. Dezember, 21.00 Uhr bis 1.00 Uhr, finden Instandhaltungsarbeiten in Zuffenhausen statt.  ;"<ul><li><strong>Die Linien S4 und S5 in Richtung Marbach bzw. Bietigheim verkehren ohne Halt in Feuerbach.</strong></li><li><strong>Die Linie S5 mit Abfahrt in Bietigheim um 23:07 Uhr verkehrt ohne Halt in Feuerbach.</strong></li><li>Fahrgäste werden gebeten, in Nordbahnhof bzw. Zuffenhausen auf die Linie S6 umzusteigen.</li></ul><p>Bitte berücksichtigen Sie diese Abweichungen bei Ihrer Reiseplanung und informieren Sie sich vorab über Ihre Reiseverbindungen. Um keine kurzfristigen Änderungen zu verpassen, informieren Sie sich bitte auch unmittelbar vor Fahrtantritt in den digitalen Reiseauskunftsmedien unter&nbsp;bahn.de&nbsp;oder in der App DB Navigator.</p>";S 4, S 5;2024-12-01T21:00:00;2024-12-02T01:00:00;RisDisruptions;;weitere Informationen;https://assets-ri.extranet.deutschebahn.com/regio_sbahn_stuttgart/2024-11-15/9afe09b7-09b1-4bac-9caf-c2d826cb125dreisendenkarte_20241111-124607.png;isInTimeInterval;2;2024-11-19T11:17:06.082845;8003411, 8002065, 8000235, 8005767, 8006700, 8005770, 8006698, 8006699, 8098096, 8001967, 8005778, 8000873, 8005820, 8000038, 8003853, 8000630;2024-11-19T12:17:09.728963
8104eb96-1043-494f-a7b7-778392aaad15;Bietigheim-Bissingen -> Ludwigsburg: Haltausfälle und Ersatzverkehr mit Bussen;Am 3. Dezember, 0.30 Uhr und 4.30 Uhr, finden zwischen Bietigheim-Bissingen und Ludwigsburg Schienenarbeiten statt.;"<ul><li><strong>S5 mit Abfahrt in Bietigheim-Bissingen um 3.52 Uhr hält nicht in Tamm und Asperg .</strong></li><li>Zwischen Bietigheim-Bissingen und Ludwigsburg fährt ein <strong>Ersatzverkehr mit Bussen</strong>.</li><li>Bitte beachten Sie, dass der Bus aufgrund der längeren Fahrtzeiten bereits um 3.30 Uhr in Bietigheim-Bissingen abfährt.</li></ul><p>Bitte berücksichtigen Sie diese Abweichungen bei Ihrer Reiseplanung und informieren Sie sich vorab über Ihre Reiseverbindungen. Um keine kurzfristigen Änderungen zu verpassen, informieren Sie sich bitte auch unmittelbar vor Fahrtantritt in den digitalen Reiseauskunftsmedien unter&nbsp;bahn.de&nbsp;oder in der App DB Navigator.</p>";S 5;2024-12-03T03:30:00;2024-12-03T04:00:00;RisDisruptions;;weitere Informationen;https://assets-ri.extranet.deutschebahn.com/regio_sbahn_stuttgart/2024-11-19/650f49fe-6deb-4787-bd3f-b7c317dce761reisendenkarte_20241118-143017.png;isInTimeInterval, isWeek;2;2024-11-19T11:17:06.082845;8005820, 8000038, 8000630, 8000235;2024-11-19T12:17:09.728991
261fc520-2cb7-40ab-8106-6f9577eda208;Ludwigsburg <> Marbach: Haltausfälle und Ersatzverkehr;In der Nacht 03./04.12., von 21.00 Uhr bis 5.00 Uhr finden zwischen Backnang und Ludwigsburg Instandhaltungsarbeiten statt.;"<ul><li><strong>S4 Richtung Schwabstraße</strong> mit Abfahrt in Marbach(N) um 22.55 Uhr, 23.25 Uhr und 23.55 Uhr entfällt zwischen Marbach(N) und Freiberg(N).</li><li><strong>S4 Richtung Marbach(N)</strong> mit planmäßiger Abfahrt in Freiberg(N) um 22.59 Uhr, 23.29 Uhr, 23.59, 0.29 Uhr, 0.59 Uhr und 1.29 Uhr entfällt zwischen Freiberg(N) und Marbach(N).</li><li><strong>Zwischen Marbach(N) und Freiberg(N) fährt ein Ersatzverkehr mit Bussen (S4E).</strong></li></ul><p>Bitte berücksichtigen Sie diese Abweichungen bei Ihrer Reiseplanung und informieren Sie sich vorab über Ihre Reiseverbindungen. Um keine kurzfristigen Änderungen zu verpassen, informieren Sie sich bitte auch unmittelbar vor Fahrtantritt in den digitalen Reiseauskunftsmedien unter&nbsp;bahn.de&nbsp;oder in der App DB Navigator.</p>";S 4;2024-12-03T21:00:00;2024-12-04T05:00:00;RisDisruptions;Fahrplan_S4E_3.-4.12.2024.pdf;weitere Informationen;https://assets-ri.extranet.deutschebahn.com/regio_sbahn_stuttgart/2024-11-19/e7039438-1e09-4398-b649-97ba66d7cb07reisendenkarte_20241118-101200.png;isInTimeInterval, isWeek;2;2024-11-19T11:17:06.082845;8002065, 8000873, 8003853;2024-11-19T12:17:09.729018
3834fe90-10de-45d3-8368-5a701674442d;4./5. Dezember Instandhaltungsarbeiten zwischen Gärtringen und S-Vaihingen;In der Nacht 4./5. Dezember im Zeitraum von ca. 21.00 Uhr bis ca. 5.00 Uhr finden Instandhaltungsarbeiten auf der Strecke zwischen Gärtringen und S-Vaihingen statt. Es kommt bei den S-Bahnen der Linie S1 zu Verspätungen und einzelnen Fahrtausfällen.;"<p>📅&nbsp; 4./5. Dezember Instandhaltungsarbeiten zwischen Gärtringen und S-Vaihingen</p><p>In der Nacht&nbsp;<strong>4./5. Dezember&nbsp;</strong>im Zeitraum&nbsp;<strong>von ca. 21.00 Uhr bis ca. 5.00 Uhr</strong>&nbsp;finden Instandhaltungsarbeiten auf der Strecke zwischen Gärtringen und S-Vaihingen statt. Es kommt bei den S-Bahnen der Linie&nbsp;<strong>S1 zu Verspätungen und einzelnen Fahrtausfällen</strong>.</p><ul><li><ul><li><strong>S1 Richtung Herrenberg, ursprüngliche Ankunft in Herrenberg um 21.44 Uhr entfällt zwischen S-Vaihingen und Herrenberg</strong>. Von S-Vaihingen nach Böblingen wird ein Ersatzverkehr mit Bussen eingerichtet, welche in S-Vaihingen um 21.26 Uhr abfahren und in Goldberg halten.</li><li><strong>S1 Richtung Kirchheim(T), ursprüngliche Abfahrt in Herrenberg um 22.16 Uhr entfällt zwischen Herrenberg und S-Vaihingen</strong>&nbsp;und beginnt erst in S-Vaihingen um 22.40 Uhr. Von Herrenberg nach Böblingen wird ein Ersatzverkehr mit Bussen eingerichtet, welche in Herrenberg um 22.16 Uhr nach Böblingen abfahren und an allen Unterwegsstationen bis Böblingen halten.</li></ul></li></ul><p>Bitte berücksichtigen Sie diese Änderungen bei Ihrer Reiseplanung und wählen gegebenenfalls eine frühere Verbindung. Bitte prüfen Sie Ihre Reiseverbindung online vor Fahrtantritt.</p>";S 1;2024-12-04T21:00:00;2024-12-05T05:00:00;RisDisruptions;;weitere Informationen;https://assets-ri.extranet.deutschebahn.com/regio_sbahn_stuttgart/2024-11-06/73de2a3d-e472-42b6-9325-902893ce3f71reisendenkarte_20241015-110321.png;isInTimeInterval, isWeek;2;2024-11-19T11:17:06.082845;8005201, 8001689, 8003022, 8005776, 8004490, 8002165, 8001055, 8005773, 8002785;2024-11-19T12:17:09.729046
114605f1-e787-489a-97d3-4856b96e26e8;Filderstadt <> Stuttgart-Vaihingen: Zugausfälle und Ersatzverkehr;In den Nächten 4./5. Dezember von 22.10 Uhr bis 4.45 Uhr sowie 6./7. Dezember von 21.30 Uhr bis 6:20 Uhr finden Schienenschleifarbeiten zwischen Stuttgart-Rohr und Flughafen/Messe statt.;"<p><strong>In der Nacht 4./5. Dezember</strong></p><ul><li>S2 verkehrt nur zwischen Schorndorf und Stuttgart-Vaihingen.</li><li>S3 verkehrt nur zwischen Backnang und Stuttgart-Vaihingen.</li><li>Zwischen Stuttgart-Vaihingen und Filderstadt fährt ein Ersatzverkehr mit Bussen (S2E). Beachten Sie bitte die längeren Fahrzeiten der Busse und wählen Sie gegebenenfalls eine frühere Verbindung.</li></ul><p><strong>In der Nacht 6./7. Dezember</strong></p><ul><li>S2 Richtung Filderstadt verkehrt ab Stuttgart-Vaihingen in einer, um 15-Minuten verschobenen Fahrplanlage.</li><li>S3 verkehrt nur zwischen Backnang und Stuttgart-Vaihingen.</li></ul><p>Bitte berücksichtigen Sie diese Abweichungen bei Ihrer Reiseplanung und informieren Sie sich vorab über Ihre Reiseverbindungen. Um keine kurzfristigen Änderungen zu verpassen, informieren Sie sich bitte auch unmittelbar vor Fahrtantritt in den digitalen Reiseauskunftsmedien unter&nbsp;bahn.de&nbsp;oder in der App DB Navigator.</p>";S 2, S 3;2024-12-04T22:10:00;2024-12-07T06:20:00;RisDisruptions;Fahrplan Ersatzverkehr S2E.pdf;weitere Informationen;https://assets-ri.extranet.deutschebahn.com/regio_sbahn_stuttgart/2024-11-15/2843cd8d-bcf3-4d8c-96c9-0ea569300193reisendenkarte_20241115-135128.png;;2;2024-11-19T11:17:06.082845;8003622, 8005773, 8005776, 8005779, 8005768, 8001984, 8001650, 8004496;2024-11-19T12:17:09.729086
