ID;Überschrift;Kurztext;Text;Linien;Startdatum;Enddatum;Quelle;Anhänge;Links;Bild;Kategorien;Nachrichtentypen;Zeitstempel;Betroffene Haltestellen;Aktualisierungszeit
ff6a337c-179b-4ce5-bc40-1ee2a7373dae;Waiblingen <-> Backnang: Zugausfälle und Ersatzverkehr mit Bussen;In den Nächten von 24. bis 26. Juni, jeweils 21.00 Uhr bis 5.00 Uhr, finden zwischen Backnang und Waiblingen Kabelarbeiten statt.;"<ul><li><strong>S3 </strong>zwischen Waiblingen und Backnang entfällt<strong>.</strong></li><li>Zwischen Waiblingen und Backnang fährt ein <strong>Ersatzverkehr mit Bussen (S3E).</strong></li></ul><p>Bitte beachten Sie, dass es im genannten Zeitraum aufgrund von Baustellen zu weiteren Fahrplanabweichungen auf der Linie S3 sowie im Gesamtnetz der S-Bahn Stuttgart kommt.</p><p>Bitte berücksichtigen Sie diese Abweichungen bei Ihrer Reiseplanung und informieren Sie sich vorab über Ihre Reiseverbindungen. Um keine kurzfristigen Änderungen zu verpassen, informieren Sie sich bitte auch unmittelbar vor Fahrtantritt in den digitalen Reiseauskunftsmedien unter&nbsp;bahn.de&nbsp;oder in der App DB Navigator.</p>";S 3;2025-06-24T21:00:00;2025-06-27T05:00:00;RisDisruptions;Fahrplan S3E Waiblingen - Backnang.pdf;;https://assets-ri.extranet.deutschebahn.com/regio_sbahn_stuttgart/2025-05-20/7b7545b8-f299-4a39-b161-f6606d0ac42dreisendenkarte_20250513-145746.png;isInTimeInterval, isWeek;2;2025-05-27T22:19:59.310601;8005454, 8004333, 8004233, 8003913, 8006479, 8000180, 8000016;2025-05-28T00:20:53.555332
6245336f-1140-4320-b6d1-3d14980bcd08;Böblingen <> Renningen: Zugausfälle und Ersatzverkehr mit Bussen;In den Nächten 26./27. sowie 27./28. Juni, jeweils von ca. 20.30 bis 5.15 Uhr, finden Instandhaltungsarbeiten in Sindelfingen statt.  ;"<p>Es kommt zu folgenden Fahrplanabweichungen:</p><p><strong>In der Nacht 26./27. Juni</strong></p><ul><li><strong>S60 </strong>verkehrt ab ca. 20.30 Uhr zwischen Renningen und Böblingen nur <strong>im 60-Minutentakt</strong>.</li><li>Zwischen Renningen und Böblingen fährt ergänzend ein <strong>Ersatzverkehr mit Bussen (S60E) im 60-Minutentakt </strong>mit allen Unterwegshalten.</li></ul><p><strong>In der Nacht 27./28. Juni</strong></p><ul><li><strong>S60 entfällt zwischen Renningen und Böblingen.</strong></li><li>Zwischen Renningen und Böblingen fährt ein <strong>Ersatzverkehr mit Bussen (S60E) </strong>mit allen Unterwegshalten.</li><li>Bitte beachten Sie die längeren Fahrtzeiten der Busse und wählen Sie gegebenenfalls eine frühere Verbindung.</li></ul><p>Bitte berücksichtigen Sie diese Abweichungen bei Ihrer Reiseplanung und informieren Sie sich vorab über Ihre Reiseverbindungen. Um keine kurzfristigen Änderungen zu verpassen, informieren Sie sich bitte auch unmittelbar vor Fahrtantritt in den digitalen Reiseauskunftsmedien unter&nbsp;bahn.de&nbsp;oder in der App DB Navigator.</p>";S 60;2025-06-26T20:30:00;2025-06-28T05:30:00;RisDisruptions;Fahrplan S60E Böblingen - Renningen.pdf;weitere Informationen;https://assets-ri.extranet.deutschebahn.com/regio_sbahn_stuttgart/2025-05-22/859c4d37-81b3-4057-9f04-13d295717a3areisendenkarte_20250324-144054.png;;2;2025-05-27T22:19:59.310601;8005001, 8003807, 8003834, 8005574, 8003808, 8000313, 8001055;2025-05-28T00:20:53.555366
ea572036-712a-432c-8c4a-8139b2ad62a2;Einschränkungen im S-Bahn-Verkehr auf den Linien S4-S6 aufgrund von Instandhaltungsarbeiten;Von 28. Juni, 4.00 Uhr, bis 7. Juli 2025, 4.00 Uhr finden zwischen Stuttgart-Kornwestheim und Stuttgart Hbf Instandhaltungsarbeiten statt.;"<ul><li>Die <strong>Linien S4 und S5</strong> verkehren nur im 30-Minuten-Takt.</li><li>Die <strong>Linien S6 und S60 </strong>fallen mit Ausnahme der Flughafenfrühanbindung zwischen Stuttgart-Zuffenhausen und Stuttgart Schwabstraße aus.</li></ul><p>Bitte berücksichtigen Sie diese Abweichungen bei Ihrer Reiseplanung und informieren Sie sich vorab über Ihre Reiseverbindungen. Um keine kurzfristigen Änderungen zu verpassen, informieren Sie sich bitte auch unmittelbar vor Fahrtantritt in den digitalen Reiseauskunftsmedien unter&nbsp;bahn.de&nbsp;oder in der App DB Navigator.</p>";S 4, S 5, S 6, S 60;2025-06-28T04:00:00;2025-07-07T04:00:00;RisDisruptions;;weitere Informationen;https://assets-ri.extranet.deutschebahn.com/regio_sbahn_stuttgart/2025-05-27/731899b9-6f30-432c-9c8c-64f2e4a2311areisendenkarte_20250523-150108.png;;2;2025-05-27T22:19:59.310601;8000016, 8006699, 8000873, 8005778, 8003853, 8000235, 8002065, 8006700, 8005767, 8001967, 8001296, 8003411, 8003266, 8005820, 8000038, 8000096, 8005770, 8098096, 8006698, 8001827, 8000630;2025-05-28T00:20:53.555396
a857076c-8a3d-4e46-b100-b2f7ca6e3d49;Einschränkungen im S-Bahnverkehr auf mehreren Linien aufgrund von Instandhaltungsarbeiten;In der Nacht 30. Juni, 22.00 Uhr bis 1. Juli, 4.30 Uhr, finden Instandhaltungsarbeiten zwischen S-Vaihingen und Bad Cannstatt statt.;"<ul><li><strong>S1 </strong>verkehrt in zwei Abschnitten getrennt: Kirchheim(T) – Hauptbahnhof (oben) und Stuttgart-Vaihingen – Herrenberg.</li><li><strong>S3 </strong>verkehrt in beiden Richtungen nur in den Abschnitten Backnang und Waiblingen.</li><li><strong>S4</strong> verkehrt in beiden Richtungen nur zwischen Marbach und Hauptbahnhof (oben).</li><li><strong>S6</strong> verkehrt in beiden Richtungen nur zwischen Weil der Stadt und Stuttgart-Zuffenhausen.</li></ul><p>Bitte beachten Sie, dass es in diesem Zeitraum zu weiteren Fahrplanabweichungen im Netz der S-Bahn Stuttgart kommt.</p><p>Bitte berücksichtigen Sie diese Abweichungen bei Ihrer Reiseplanung und informieren Sie sich vorab über Ihre Reiseverbindungen. Um keine kurzfristigen Änderungen zu verpassen, informieren Sie sich bitte auch unmittelbar vor Fahrtantritt in den digitalen Reiseauskunftsmedien unter&nbsp;bahn.de&nbsp;oder in der App DB Navigator.</p>";S 1, S 3, S 4, S 6;2025-06-30T22:00:00;2025-07-01T04:30:00;RisDisruptions;;weitere Informationen;https://assets-ri.extranet.deutschebahn.com/regio_sbahn_stuttgart/2025-05-27/2a0ec5e7-c244-4c01-9568-a0712380b7f1reisendenkarte_20250526-164343.png;isInTimeInterval, isWeek;2;2025-05-27T22:19:59.310601;8006699, 8006513, 8006700, 8005779, 8001650, 8005776, 8004496, 8003622, 8000180, 8005769, 8006698, 8098096, 8005773, 8005768, 8001974;2025-05-28T00:20:53.555421
b96be562-5ef4-42b6-b28d-4803adbe9626;Böblingen <> Sindelfingen: Zugausfälle und Ersatzverkehr mit Bussen ;In der Nacht 1./2. Juli, ca. 20.30 bis 1 Uhr, finden Instandhaltungsarbeiten zwischen Herrenberg und S-Vaihingen statt.;"<ul><li><strong>S60</strong> fällt zwischen Böblingen und Sindelfingen aus.</li><li>Zwischen Böblingen und Sindelfingen fährt ein <strong>Ersatzverkehr mit Bussen (S60E)</strong> im 30-Minuten-Takt.</li><li>Bitte beachten Sie die früheren Abfahrtszeiten der Busse in Böblingen und wählen Sie gegebenenfalls eine frühere Verbindung.</li></ul><p>Bitte beachten Sie, dass es in diesem Zeitraum zu weiteren Fahrplanabweichungen im Netz der S-Bahn Stuttgart kommt.</p><p>Bitte berücksichtigen Sie diese Abweichungen bei Ihrer Reiseplanung und informieren Sie sich vorab über Ihre Reiseverbindungen. Um keine kurzfristigen Änderungen zu verpassen, informieren Sie sich bitte auch unmittelbar vor Fahrtantritt in den digitalen Reiseauskunftsmedien unter&nbsp;bahn.de&nbsp;oder in der App DB Navigator.</p>";S 60;2025-07-01T20:00:00;2025-07-02T01:00:00;RisDisruptions;Fahrplan S60E Sindelfingen - Böblingen.pdf;weitere Informationen;https://assets-ri.extranet.deutschebahn.com/regio_sbahn_stuttgart/2025-05-22/c6d6a4d5-8ad0-4d58-91e3-a5e101c87d31reisendenkarte_20250521-103018.png;isWeek;2;2025-05-27T22:19:59.310601;8005574, 8001055;2025-05-28T00:20:53.555449
