ID;Überschrift;Kurztext;Text;Linien;Startdatum;Enddatum;Quelle;Anhänge;Links;Bild;Kategorien;Nachrichtentypen;Zeitstempel;Betroffene Haltestellen;Aktualisierungszeit
43167a63-b57f-43ca-bd98-e3b2bb9652b0;Marbach <> Backnang: Stündlicher S4-Pendelverkehr von 5 bis 10 Uhr und 13 bis 19 Uhr. Zusätzlich Ersatzverkehr mit Bussen.;"Die Deutsche Bahn hat die ""kleine Murrbahn"" nach Unwetterschäden mit umfangreichen Reparatur- und Präventionsmaßnahmen instandgesetzt.";"<p><strong>Update: Weitere Bauarbeiten und Einschränkungen zwischen Marbach(N) und Backnang.</strong></p><p>Von 12. Mai, 4.00 Uhr bis 17. Mai, 4.00 Uhr finden in Kirchberg(Murr) Arbeiten an der Infrastruktur zur Beseitigung der Unwetterfolgen statt. Es kommt zu folgenden Einschränkungen:</p><ul><li><strong>Die Züge des S4-Pendel Marbach(N) &lt;&gt; Backnang fallen zwischen Marbach(N) und Backnang komplett aus.</strong></li><li>Zwischen Marbach(N) und Backnang verkehrt ein&nbsp;<strong>Ersatzverkehr mit Bussen (S4E).</strong></li></ul><p>Außerhalb des oben genannten Zeitraumes gilt weiterhin bis zum ""kleinen"" Fahrplanwechsel im Juni 2025 folgendes Betriebskonzept:</p><p><strong>Seit Sonntag, 15. Dezember verkehrt die Linie S4 zwischen 5 und 10 Uhr sowie von 13 bis 19 Uhr</strong> <strong>stündlich zwischen Marbach und Backnang. </strong>Maßgeblich für den Stundentakt ist, dass vorübergehend alle Züge noch mit deutlich verminderter Geschwindigkeit fahren müssen und sich dadurch in beide Richtungen <strong>etwa um acht Minuten längere Fahrzeiten </strong>ergeben. Damit sich vom Zugbetrieb auf der eingleisigen Strecke keine Verzögerungen in das S-Bahn-Netz übertragen, fahren die <strong>S4-Züge zwischen Marbach und Backnang bis auf Weiteres im Pendelverkehr</strong>.</p><p><strong>Der S4-Pendel fährt jeweils zur Minute .13 in Marbach ab und kommt zur Minute .34 in Backnang an. In der Gegenrichtung startet der S4-Pendel jeweils zur Minute .43 in Backnang und erreicht zur Minute .04 Marbach. </strong></p><p><strong>In Marbach besteht jeweils Anschluss von und nach Stuttgart Schwabstraße.</strong> Die S-Bahnen der S4 zwischen Marbach und Stuttgart Schwabstraße fahren von montags bis samstags tagsüber durchgängig im 15-Minuten-Takt, darüber hinaus im Halbstundentakt.&nbsp;</p><h1><strong>Zusätzlich Ersatzverkehr mit Bussen&nbsp;</strong></h1><p>Damit wie üblich stündlich zwei Fahrten zwischen Marbach und Backnang angeboten werden, setzt die <strong>DB zusätzlich weiterhin Busse der Linie S4E</strong> ein.</p><p><strong>Während der Betriebszeiten des S4-Pendels</strong> fahren die Busse zur Minute .48 in Marbach und zur Minute .13 in Backnang ab.</p><p><strong>Außerhalb der Angebotszeiten des S4-Pendels</strong> fahren die Busse in Marbach zu den Minuten .18 und .48 ab. Die Busse starten dann zu den Minuten .13 und .43 in Backnang. In Erdmannhausen liegt die Haltestelle für den Ersatzverkehr auch weiterhin im Ort.&nbsp;(Erdmannhausen, Bahnhofstraße und Erdmannhausen, Rathaus).</p><p>Die Busse (S4E) halten an folgenden Haltestellen:</p><ul><li>Marbach(N), Bahnhof</li><li>Erdmannhausen, Bahnhofstraße</li><li>Erdmannhausen, Rathaus</li><li>Kirchberg (M), Marbacher Str.</li><li>Kirchberg (M), Rathaus</li><li>Burgstall (M), Bahnhof</li><li>Erbstetten-Ortsmitte</li><li>Backnang, ZOB</li></ul><p>Bitte informieren Sie sich vor Fahrtantritt und planen die längere Fahrzeit der Busse mit ein.</p>";S 4;2024-06-26T19:35:00;2025-06-14T23:59:00;RisDisruptions;"Fahrgastinformation_S4.pdf; Fahrplan S4E Backnang - Marbach_12.-17.05.pdf; Fahrplan Ersatzverkehr S4E Marbach - Backnang ab 11.01.25.pdf";"weitere Informationen; Betriebslage; Informationen zu den Abfahrtshaltestellen des Ersatzverkehrs";https://assets-ri.extranet.deutschebahn.com/regio_sbahn_stuttgart/2025-05-06/e9fa6c04-aff9-4aa5-b76a-999b66656444reisendenkarte_20241219-151330.png;;2;2025-05-12T09:26:42.786635;8003853, 8000873, 8001827;2025-05-12T11:30:55.652046
e1a241c5-6b75-4060-87ce-91ae549ee5d9;Instandhaltungsfenster 2025: Fahrtänderungen im S-Bahnverkehr;Wegen Instandhaltungsarbeiten im S-Bahn-Tunnel kommt es in mehreren Nächten von Montag auf Dienstag zwischen 22.30 Uhr und 4.30 Uhr zu Fahrplanänderungen im S-Bahn-Verkehr. Sobald uns das genaue Betriebsprogramm zu den einzelnen Nächten vorliegt, finden Sie die detaillierten Informationen zu den konkreten Fahrplanänderungen unter dem jeweiligen Datum gesondert dargestellt.;"<p>Das Instandhaltungsfenster findet jeweils in der Nacht von Montag auf Dienstag statt. Dafür sind folgende Nächte vorgesehen (Änderungen vorbehalten):</p><ul><li>12./13. Mai, 19./20. Mai,</li><li>2./3. Juni, 23./24. Juni, 30. Juni/1. Juli,</li><li>14./15. Juli, 21./22. Juli,</li><li>15./16. September, 22./23. September,</li><li>13./14. Oktober, 20./21. Oktober,</li><li>3./4. November, 17./18. November</li><li>1./2. Dezember</li></ul><p><strong>Warum eigentlich Instandhaltungsfenster?</strong></p><p>Damit die Gleise und die Technik im S-Bahntunnel fit bleiben, benötigt InfraGo auch im Jahresfahrplan 2025 für die Instandhaltungsarbeiten ausreichend zusammenhängende Zeitfenster.&nbsp;Um tagsüber den Betrieb nicht zu stören, wurden die Arbeiten nachts in Instandhaltungsfenstern gebündelt.</p><p>Die DB InfraGo hat als Infrastrukturbetreiber mit der S-Bahn Stuttgart folgendes Grundkonzept erarbeitet:</p><p>Zwischen Stuttgart-Vaihingen und Stuttgart Hbf (tief) bzw. Bad Cannstatt wird während dieser Zeit lediglich ein reduziertes Fahrplanangebot&nbsp;im S-Bahntunnel gefahren. Zudem werden in diesem Zeitraum die Fahrzeiten einzelner Linien angepasst, sodass Anschlüsse ggf. nicht erreicht werden.&nbsp;Die Fahrplanänderungen werden kontinuierlich in die Fahrplanmedien eingepflegt und dann über die elektronische Fahrplanauskunft bei der DB oder in den Apps abrufbar sein.&nbsp;</p>";S 1, S 2, S 3, S 4, S 5, S 6;2025-01-27T22:30:00;2025-12-01T04:30:00;RisDisruptions;;weitere Informationen;https://assets-ri.extranet.deutschebahn.com/regio_sbahn_stuttgart/2025-04-16/0d13e031-e6c2-45d5-9857-d35fb69f6ddcreisendenkarte_20241112-155203.png;isInTimeInterval, isWeek;2;2025-05-12T09:26:42.786635;8006700, 8006699, 8006513, 8005779, 8005769, 8098096, 8006698, 8005776;2025-05-12T11:30:55.652122
023dd9c2-41b9-485f-b5e5-902f0efc96ed;RB 64 (Teckbahn) verkehrt mit geringerer Kapazität;Die Teckbahn verkehrt zwischen Kirchheim(T) und Oberlenningen mit einer geringeren Kapazität an SItzplätzen aufgrund fristgemäßen Instandsetzungsarbeiten an Fahrzeugen;<p><strong>An Schultagen werden zusätzliche Busse eingesetzt:</strong></p><ul><li>Von Kirchheim(T) nach Oberlenningen, Abfahrten: 5.16, 6.16, 7.16, 8.16, 9.16, 10.16, 11.16, 12.16 und 13.16 Uhr</li><li>Von Oberlenningen nach Kirchheim(T), Abfahrten: 5.48, 6.48, 7.48, 8.48, 9.48, 10.48, 11.48, 12.48 und 13.48 Uhr</li></ul><p>Bitte beachten Sie die Abfahrts- und Reisezeiten der Busse. Die Busse fahren an den Haltestellen der Linie 177 ab.</p><p></p><p>Bitte prüfen Sie Ihre Reiseverbindung online vor Fahrtantritt. Wir informieren Sie, sobald sich Neuigkeiten ergeben.</p>;RB 64;2025-04-02T05:00:00;2025-06-04T13:48:00;RisDisruptions;Verstärkung RB64 an Schultagen.pdf;weitere Informationen;;isWeek;1;2025-05-12T09:26:42.786635;8001428, 8001205, 8003283, 8004740, 8004553, 8003280, 8005998;2025-05-12T11:30:55.652162
f46d5c82-6c96-4164-89cb-50a39646b72e;Instandhaltungsarbeiten zwischen Stuttgart Hbf und Esslingen(N) sowie Bahnsteigarbeiten in Esslingen-Mettingen;Bis 26. Juli 2025 kommt es zwischen Stuttgart Hbf und Esslingen(Neckar) zeitweise zu Fahrplaneinschränkungen auf der Linie S1. Bitte informieren Sie sich!;"<p><strong>Von Samstag, 3. Mai bis Samstag, 26. Juli</strong></p><ul><li>Die Linie S1 Kirchheim(T) &lt;&gt; Herrenberg verkehrt nur im 30-Minuten-Takt und wird montags bis freitags von 6 Uhr bis 20.30 Uhr sowie samstags von 8.30 Uhr bis 20.30 Uhr durch zusätzliche Fahrten der Linie S11 zwischen Neckarpark und Herrenberg zum 15-Minuten-Takt ergänzt.</li></ul><p><strong>In den Nächten 5./6. Juni und 6./7. Juni, jeweils von 21.00 Uhr bis 5.00 Uhr</strong></p><p>Instandhaltungsarbeiten zwischen Stuttgart Hbf und Esslingen (Neckar).</p><ul><li>Detaillierte Informationen zum Betriebs- und Ersatzkonzept werden zeitnah veröffentlicht.</li></ul><p>Bitte berücksichtigen Sie diese Abweichungen bei Ihrer Reiseplanung und informieren Sie sich vorab über Ihre Reiseverbindungen. Um keine kurzfristigen Änderungen zu verpassen, informieren Sie sich bitte auch unmittelbar vor Fahrtantritt in den digitalen Reiseauskunftsmedien unter&nbsp;bahn.de&nbsp;oder in der App DB Navigator.</p>";S 1, S 11;2025-04-10T21:00:00;2025-07-26T04:00:00;RisDisruptions;Übersicht Einschränkungen Linie S1.pdf;weitere Informationen;https://assets-ri.extranet.deutschebahn.com/regio_sbahn_stuttgart/2025-05-12/4e36a678-bf21-45a6-b48e-45ea618e786creisendenkarte_20250411-085727.png;;2;2025-05-12T09:26:42.786635;8005772, 8001921, 8005769, 8005775, 8001920, 8006743;2025-05-12T11:30:55.652183
7119466a-b0ed-4274-a536-c370d9b95973;Weichenarbeiten in Renningen: Fahrplanabweichungen, Zugausfälle und Ersatzverkehr mit Bussen;Von 9. Mai, 1.30 Uhr bis 27. Mai, 5.30 Uhr finden in Renningen Weichenarbeiten statt. Es kommt daher zeitweise zu folgenden Einschränkungen:;"<p><strong>In der Nacht 9./10. Mai:</strong></p><ul><li><strong>S6</strong> fällt zeitweise zwischen Renningen und Weil der Stadt aus.</li><li><strong>Ersatzverkehr mit Bussen (S6E)</strong> zwischen Weil der Stadt und Renningen.</li><li><strong>S60</strong>: Ausfall einzelner Fahrten in der Nacht 9./10. Mai</li><li><strong>Ersatzverkehr mit Bussen (S60E)</strong> zwischen Böblingen und Renningen.</li></ul><p><strong>Von 14. bis 27. Mai:</strong></p><ul><li><strong>S6</strong> fällt durchgehend zwischen Renningen und Weil der Stadt aus.</li><li><strong>S6 </strong>fällt <strong>am 26. und 27. Mai (jeweils zwischen 1.30 und 5.30 Uhr) zusätzlich zwischen Weil der Stadt/Renningen &lt;&gt; Leonberg</strong> aus.</li><li><strong>S60 </strong>verkehrt<strong> </strong>aufgeteilt in zwei Abschnitte <strong>Renningen (Gleis 3) &lt;&gt; Schwabstraße</strong> sowie <strong>Renningen (Gleis 1) &lt;&gt; Böblingen.</strong></li><li><strong>Ersatzverkehr mit Bussen (S6E) </strong>zwischen Weil der Stadt und Renningen, in den Nächten 26. und 27. Mai (jeweils zwischen 3 Uhr und 4 Uhr) zusätzlich bis Leonberg</li></ul><p>Bitte berücksichtigen Sie diese Abweichungen bei Ihrer Reiseplanung und informieren Sie sich vorab über Ihre Reiseverbindungen. Um keine kurzfristigen Änderungen zu verpassen, informieren Sie sich bitte auch unmittelbar vor Fahrtantritt in den digitalen Reiseauskunftsmedien unter&nbsp;bahn.de&nbsp;oder in der App DB Navigator.</p>";S 6, S 60;2025-05-09T01:30:00;2025-05-27T05:30:00;RisDisruptions;Fahrplan Ersatzverkehr S6E Weil der Stadt - Renningen.pdf;weitere Informationen;https://assets-ri.extranet.deutschebahn.com/regio_sbahn_stuttgart/2025-05-06/e8f79af5-fadf-4673-b4fd-bfbb0c472cd4reisendenkarte_20250428-102121.png;;2;2025-05-12T09:26:42.786635;8003831, 8005236, 8005001, 8006271, 8000313;2025-05-12T11:30:55.652248
dc684ddd-2e99-4531-84e3-257b61fc52a9;Marbach(N) <> Backnang: Zugausfälle und Ersatzverkehr mit Bussen;Von 12. Mai, 4.00 Uhr bis 17. Mai, 4.00 Uhr finden in Kirchberg(Murr) Arbeiten an der Infrastruktur zur Beseitigung der Unwetterfolgen statt. Es kommt zu folgenden Einschränkungen:;"<ul><li><strong>Die Züge des S4-Pendel Marbach(N) &lt;&gt; Backnang fallen zwischen Marbach(N) und Backnang komplett aus.</strong></li><li>Zwischen Marbach(N) und Backnang verkehrt ein <strong>Ersatzverkehr mit Bussen (S4E).</strong></li></ul><p>Bitte berücksichtigen Sie diese Abweichungen bei Ihrer Reiseplanung und informieren Sie sich vorab über Ihre Reiseverbindungen. Um keine kurzfristigen Änderungen zu verpassen, informieren Sie sich bitte auch unmittelbar vor Fahrtantritt in den digitalen Reiseauskunftsmedien unter&nbsp;bahn.de&nbsp;oder in der App DB Navigator.</p>";S 4;2025-05-12T04:00:00;2025-05-17T04:00:00;RisDisruptions;Fahrplan S4E Backnang - Marbach.pdf;weitere Informationen;https://assets-ri.extranet.deutschebahn.com/regio_sbahn_stuttgart/2025-04-22/9d080eff-3936-4467-83e9-c04e97d4dd39reisendenkarte_20250411-155909.png;;2;2025-05-12T09:26:42.786635;8003853, 8000016, 8001296, 8003266, 8001827;2025-05-12T11:30:55.652286
b6f29c34-de8d-49d4-8678-1e2cab2c8aac;Einschränkungen im S-Bahnverkehr auf mehreren Linien aufgrund von Instandhaltungsarbeiten ;In der Nacht 12./13. Mai finden Instandhaltungsarbeiten zwischen S-Vaihingen und Bad Cannstatt statt.;"<ul><li><strong>S1 </strong>verkehrt in beiden Richtungen mit geändertem Linienverlauf: Herrenberg - Hauptbahnhof (oben) - (ohne Halt zwischen Hauptbahnhof (tief) und S-Vaihingen) - Kirchheim (T).</li><li><strong>S3 </strong>verkehrt in beiden Richtungen nur in den Abschnitten Backnang und Waiblingen sowie Vaihingen und Flughafen/Messe.</li><li><strong>S4</strong> verkehrt in beiden Richtungen nur zwischen Marbach und Hauptbahnhof (oben).</li><li><strong>S6</strong> verkehrt in beiden Richtungen nur zwischen Weil der Stadt und Hauptbahnhof (oben).</li></ul><p>Bitte berücksichtigen Sie diese Abweichungen bei Ihrer Reiseplanung und informieren Sie sich vorab über Ihre Reiseverbindungen. Um keine kurzfristigen Änderungen zu verpassen, informieren Sie sich bitte auch unmittelbar vor Fahrtantritt in den digitalen Reiseauskunftsmedien unter&nbsp;bahn.de&nbsp;oder in der App DB Navigator.</p>";S 1, S 3, S 4, S 6;2025-05-12T22:00:00;2025-05-13T04:30:00;RisDisruptions;;weitere Informationen;https://assets-ri.extranet.deutschebahn.com/regio_sbahn_stuttgart/2025-04-22/9d5ad305-a3a7-462c-a8d3-63f412d9727dreisendenkarte_20250401-105309.png;isInTimeInterval, isWeek;2;2025-05-12T09:26:42.786635;8006699, 8006513, 8006700, 8005779, 8001974, 8005769, 8006698, 8005776, 8098096, 8000180;2025-05-12T11:30:55.652310
4bdfce0e-c6fb-437e-ac06-e9f147508182;Einschränkungen im S-Bahnverkehr auf mehreren Linien aufgrund von Instandhaltungsarbeiten;In der Nacht 19./20. Mai finden Instandhaltungsarbeiten zwischen S-Vaihingen und Bad Cannstatt statt.;"<ul><li><strong>S1 </strong>verkehrt in beiden Richtungen mit geändertem Linienverlauf: Herrenberg - Hauptbahnhof (oben) - (ohne Halt zwischen Hauptbahnhof (tief) und S-Vaihingen) - Kirchheim (T).</li><li><strong>S3 </strong>verkehrt in beiden Richtungen nur in den Abschnitten Backnang und Waiblingen sowie Vaihingen und Flughafen/Messe.</li><li><strong>S4</strong> verkehrt in beiden Richtungen nur zwischen Marbach und Hauptbahnhof (oben).</li><li><strong>S6</strong> verkehrt in beiden Richtungen nur zwischen Weil der Stadt und Hauptbahnhof (oben).</li></ul><p>Bitte berücksichtigen Sie diese Abweichungen bei Ihrer Reiseplanung und informieren Sie sich vorab über Ihre Reiseverbindungen. Um keine kurzfristigen Änderungen zu verpassen, informieren Sie sich bitte auch unmittelbar vor Fahrtantritt in den digitalen Reiseauskunftsmedien unter&nbsp;bahn.de&nbsp;oder in der App DB Navigator.</p>";S 1, S 3, S 4, S 6;2025-05-19T22:00:00;2025-05-20T04:30:00;RisDisruptions;;weitere Informationen;https://assets-ri.extranet.deutschebahn.com/regio_sbahn_stuttgart/2025-04-22/2dea1b21-0c6d-448c-8699-9bbdeda0d681reisendenkarte_20250410-085055.png;isInTimeInterval, isWeek;2;2025-05-12T09:26:42.786635;8006698, 8098096, 8006699, 8006513, 8006700, 8005779, 8005776, 8004357, 8005774, 8001974, 8005769, 8000096, 8000180;2025-05-12T11:30:55.652337
e286bbb9-aefc-49d0-b404-4213636c5dc6;Waiblingen <> Backnang: Zugausfälle und Ersatzverkehr mit Bussen;In den Nächten von 23.Mai bis 13.Juni - jeweils 21 bis 5 Uhr - finden zwischen Backnang und Waiblingen Kabelarbeiten statt.;"<ul><li><strong>S3 </strong>zwischen Waiblingen und Backnang entfällt<strong>.</strong></li><li>Zwischen Waiblingen und Backnang fährt ein <strong>Ersatzverkehr mit Bussen (S3E).</strong></li></ul><p>Bitte beachten Sie, dass es im genannten Zeitraum aufgrund von Baustellen zu weiteren Fahrplanabweichungen auf der Linie S3 sowie im Gesamtnetz der S-Bahn Stuttgart kommt.</p><p>Bitte berücksichtigen Sie diese Abweichungen bei Ihrer Reiseplanung und informieren Sie sich vorab über Ihre Reiseverbindungen. Um keine kurzfristigen Änderungen zu verpassen, informieren Sie sich bitte auch unmittelbar vor Fahrtantritt in den digitalen Reiseauskunftsmedien unter&nbsp;bahn.de&nbsp;oder in der App DB Navigator.</p>";S 3;2025-05-23T21:00:00;2025-06-13T05:00:00;RisDisruptions;Fahrplan S3E Waiblingen -Backnang.pdf;weitere Informationen;https://assets-ri.extranet.deutschebahn.com/regio_sbahn_stuttgart/2025-05-09/0bc9e6d2-7d17-4b25-9672-27f6da78e955reisendenkarte_20250506-153659.png;isInTimeInterval;2;2025-05-12T09:26:42.786635;8005454, 8004333, 8004233, 8003913, 8006479, 8000180, 8000016;2025-05-12T11:30:55.652366
6ca2d2c1-f0cc-4167-b7f6-f6f068cdd96f;Ludwigsburg -> Bietigheim: Haltausfälle und Ersatzverkehr mit Bussen ;Am 25. Mai, 1 bis 4 Uhr, finden zwischen Tamm und Bietigheim Stopfarbeiten statt. ;"<ul><li><strong>S5 in Richtung Bietigheim hält nicht in Asperg und Tamm.</strong></li><li>Zwischen Ludwigsburg und Bietigheim fährt ein <strong>Ersatzverkehr mit Bussen (S5E).</strong></li></ul><p>Bitte berücksichtigen Sie diese Abweichungen bei Ihrer Reiseplanung und informieren Sie sich vorab über Ihre Reiseverbindungen. Um keine kurzfristigen Änderungen zu verpassen, informieren Sie sich bitte auch unmittelbar vor Fahrtantritt in den digitalen Reiseauskunftsmedien unter&nbsp;bahn.de&nbsp;oder in der App DB Navigator.</p>";S 5;2025-05-25T01:00:00;2025-05-25T04:00:00;RisDisruptions;Fahrplan S5E Ludwigsburg - Bietigheim.pdf;;https://assets-ri.extranet.deutschebahn.com/regio_sbahn_stuttgart/2025-05-12/0cfa3a1c-3483-4249-8657-a513e7745da0reisendenkarte_20250512-083015.png;isInTimeInterval, isWeekend;2;2025-05-12T09:26:42.786635;8000630, 8005820, 8000235, 8000038;2025-05-12T11:30:55.652390
5bdcdaad-7151-4f2a-985f-6cf9c28be3bd;Waiblingen <> Schorndorf: Totalsperrung und Ersatzverkehr mit Bussen;Am 25. Mai, 3.30 bis 24 Uhr, finden zwischen Waiblingen und Schorndorf Arbeiten an der Leit- und Sicherungstechnik statt.;"<ul><li><strong>S2 entfällt zwischen Waiblingen und Schorndorf.</strong></li><li>Zwischen Waiblingen (ZOB Halteplatz 11) und Schorndorf (Bahnhof, Halteplatz 1) fährt ein <strong>Ersatzverkehr mit Bussen (S2E)</strong> mit allen Unterwegshalten.</li><li>Bitte beachten Sie die früheren Abfahrtszeiten der Busse in Schorndorf und die längeren Fahrtzeiten der Busse. Wählen Sie gegebenenfalls eine frühere Verbindung.</li></ul><p>Bitte berücksichtigen Sie diese Abweichungen bei Ihrer Reiseplanung und informieren Sie sich vorab über Ihre Reiseverbindungen. Um keine kurzfristigen Änderungen zu verpassen, informieren Sie sich bitte auch unmittelbar vor Fahrtantritt in den digitalen Reiseauskunftsmedien unter&nbsp;bahn.de&nbsp;oder in der App DB Navigator.</p>";S 2;2025-05-25T03:00:00;2025-05-25T23:55:00;RisDisruptions;Fahrplan S2E Waiblingen - Schorndorf.pdf;weitere Informationen;https://assets-ri.extranet.deutschebahn.com/regio_sbahn_stuttgart/2025-04-30/7c0275af-7406-473f-9e40-5b51a042062ereisendenkarte_20250325-125520.png;isWeekend;2;2025-05-12T09:26:42.786635;8006485, 8002240, 8000934, 8005726, 8005157, 8006277, 8001785, 8002448, 8000180, 8005424;2025-05-12T11:30:55.652421
cfe484ed-920e-4dac-aa73-cb6d2289e5d5;Plochingen <> Kirchheim (T): Haltausfälle und Ersatzverkehr mit Bussen;In der Nacht 25./26. Mai, 21 bis 5 Uhr, finden Instandhaltungsarbeiten zwischen Plochingen und Wendlingen statt.;"<ul><li><strong>S1 hält nicht zwischen Plochingen und Kirchheim (T).</strong></li><li>Zwischen Plochingen und Kirchheim (T) fährt ein&nbsp;<strong>Ersatzverkehr mit Bussen (S1E)</strong>.</li><li>Bitte beachten Sie die früheren Abfahrtszeiten der Busse in Kirchheim (T) sowie die längeren Fahrtzeiten der Busse. Wählen Sie gegebenenfalls eine frühere Verbindung.</li></ul><p>Bitte berücksichtigen Sie diese Abweichungen bei Ihrer Reiseplanung und informieren Sie sich vorab über Ihre Reiseverbindungen. Um keine kurzfristigen Änderungen zu verpassen, informieren Sie sich bitte auch unmittelbar vor Fahrtantritt in den digitalen Reiseauskunftsmedien unter&nbsp;bahn.de&nbsp;oder in der App DB Navigator.</p><p></p>";S 1;2025-05-25T20:30:00;2025-05-26T04:00:00;RisDisruptions;Fahrplan S1E Plochingen - Kirchheim.pdf;weitere Informationen;https://assets-ri.extranet.deutschebahn.com/regio_sbahn_stuttgart/2025-04-30/e5391db7-0fea-4a01-ab92-147e067364e1reisendenkarte_20250325-132927.png;isInTimeInterval;2;2025-05-12T09:26:42.786635;8000302, 8003282, 8006346, 8006331, 8003280;2025-05-12T11:30:55.652447
90c06c29-a645-4a2c-9b3b-04f6fd4a83a0;Stuttgart Hbf <> Filderstadt: Zugausfälle und Ersatzverkehr mit Bussen.;Von Samstag, 31. Mai, 01.00 Uhr bis Montag, 2. Juni, 4.00 Uhr finden im Bahnhof Stuttgart-Vaihingen umfangreiche Bauarbeiten statt. Es kommt daher zu folgenden Einschränkungen auf den Linien S1, S2 und S3 zwischen Stuttgart Hbf und Filderstadt:;"<ul><li><strong>S1</strong> fällt zwischen Stuttgart Schwabstraße und Stuttgart-Vaihingen aus.</li><li><strong>S2 </strong>fällt zwischen Stuttgart Hbf (tief) und Filderstadt aus. Die S2 verkehrt nur zwischen Stuttgart Hbf (oben) und Schorndorf.</li><li><strong>S3</strong> fällt zwischen Stuttgart-Bad Cannstatt und Stuttgart-Vaihingen bzw. Flughafen/Messe aus.</li><li>Die Linien S1, S2 und S3 verkehren am Samstag, 31. Mai nur im 30-Minuten-Takt.</li></ul><p><strong>Ersatzverkehr mit Bussen:</strong></p><ul><li><strong>SEV1 Stuttgart Hbf, Arnulf-Klett-Platz &lt;&gt; Stuttgart-Vaihingen, Bf/ZOB</strong> im 10-Minuten-Takt.</li><li><strong>S2E </strong>Stuttgart-Vaihingen, Bf/ZOB &lt;&gt; Filderstadt mit allen Unterwegshalten im 30 bzw. 60-Minuten-Takt.</li><li><strong>S2X Direktbus </strong>Stuttgart-Vaihingen, Vollmoellerstraße &lt;&gt; Flughafen/Messe, SAB im 30-Minuten-Takt ohne Unterwegshalt.</li></ul><p><strong>Reisealternativen:</strong></p><ul><li>RE14 Stuttgart Hbf &lt;&gt; Freudenstadt/Rottweil mit Zusatzhalt in Stuttgart-Vaihingen</li><li>Stadtbahn-Linie U6 von/nach Flughafen/Messe.</li></ul><p>Bitte berücksichtigen Sie diese Abweichungen bei Ihrer Reiseplanung und informieren Sie sich vorab über Ihre Reiseverbindungen. Um keine kurzfristigen Änderungen zu verpassen, informieren Sie sich bitte auch unmittelbar vor Fahrtantritt in den digitalen Reiseauskunftsmedien unter&nbsp;bahn.de&nbsp;oder in der App DB Navigator.</p>";S 1, S 2, S 3;2025-05-31T01:00:00;2025-06-02T04:00:00;RisDisruptions;"Fahrplan Ersatzverkehr S2X.pdf; Fahrplan Ersatzverkehr S2E.pdf; Fahrplan Ersatzverkehr SEV1.pdf";weitere Informationen;https://assets-ri.extranet.deutschebahn.com/regio_sbahn_stuttgart/2025-05-06/4ac56fca-f702-44ce-8ed1-7332777752d9reisendenkarte_20250403-153836.png;;2;2025-05-12T09:26:42.786635;8005776, 8005779, 8006513, 8003622, 8006700, 8006699, 8005773, 8005768, 8001984, 8006698, 8001650, 8004496, 8098096, 8005769;2025-05-12T11:30:55.652489
6011822d-77cb-4169-bc95-9f5d8f5b2912;Bad Cannstatt/Grunbach <> Schorndorf: Haltausfälle und Ersatzverkehr mit Bussen;In den Nächten 2./3. und 3./4. Juni, jeweils ca. 21 bis 0.30 Uhr, finden Instandhaltungsarbeiten zwischen Waiblingen und Lorch statt.;"<p><strong>2./3. Juni</strong></p><ul><li><strong>S2</strong>: die Züge mit Abfahrt in Filderstadt um 20.33 und 22.03 (Ankunft in Bad Cannstatt um 21.09 und 22.39 Uhr) sowie mit Abfahrt in Schorndorf um 23.18 Uhr entfallen zwischen Bad Cannstatt und Schorndorf.</li></ul><p><strong>3./4. Juni</strong></p><ul><li><strong>S2 </strong>verkehrt zwischen Grunbach und Schorndorf nur im 60-Minutentakt.</li><li>Zwischen Grunbach und Schorndorf fährt ergänzend ein <strong>Ersatzverkehr mit Bussen (S2E)</strong>.</li><li>Bitte beachten Sie die früheren Abfahrtszeiten der Busse in Schorndorf sowie die längeren Fahrtzeiten der Busse. Wählen Sie gegebenenfalls eine frühere Verbindung.</li></ul><p>Bitte berücksichtigen Sie diese Abweichungen bei Ihrer Reiseplanung und informieren Sie sich vorab über Ihre Reiseverbindungen. Um keine kurzfristigen Änderungen zu verpassen, informieren Sie sich bitte auch unmittelbar vor Fahrtantritt in den digitalen Reiseauskunftsmedien unter&nbsp;bahn.de&nbsp;oder in der App DB Navigator.</p>";S 2;2025-06-02T21:00:00;2025-06-04T00:30:00;RisDisruptions;Fahrplan S2E Schorndorf - Grunbach.pdf;weitere Informationen;https://assets-ri.extranet.deutschebahn.com/regio_sbahn_stuttgart/2025-05-07/900fd1a9-93c0-42c0-9c73-804c0fa803fbreisendenkarte_20250325-112529.png;isWeek;2;2025-05-12T09:26:42.786635;8006485, 8002240, 8000934, 8005726, 8005157, 8006277, 8001974, 8001785, 8002448, 8000180, 8005424;2025-05-12T11:30:55.652527
